{
  "schema_version": 1,
  "id": "adwf-develop",
  "kind": "router",
  "lifecycle": "ACTIVE",
  "origin": {
    "kind": "first_party"
  },
  "description": "Router ADWF для разработки, диагностики, восстановления рабочей среды, передачи сессии и проверки завершения с progressive disclosure.",
  "entrypoint": "SKILL.md",
  "routing": {
    "startup_visible": true,
    "routed_by": [],
    "routes": [
      "adwf-local-git-mirror",
      "adwf-session-bootstrap",
      "adwf-session-handoff",
      "adwf-verification-before-completion"
    ],
    "trigger_terms": [
      "разработ",
      "implementation",
      "debugging",
      "локальный git",
      "новая сессия",
      "handoff",
      "verification before completion"
    ],
    "negative_terms": [
      "release only",
      "incident only",
      "cost only"
    ]
  },
  "effects": {
    "shell": false,
    "filesystem": "none",
    "network": "none",
    "secrets": "none"
  },
  "external_domains": [],
  "dependencies": [],
  "evals": {
    "trigger_positive": "evals/trigger-positive.json",
    "trigger_negative": "evals/trigger-negative.json",
    "success_cases": "evals/success-cases.json",
    "adversarial": "evals/adversarial.json"
  },
  "quality": {
    "min_no_trigger_precision": 1.0
  },
  "context_budget": {
    "max_description_chars": 320,
    "max_skill_md_chars": 12000
  }
}
